"sponser_name","sponser_level","sponser_city","sponser_state","sponser_country","sponser_description","sponser_website","sponser_linkedin","sponser_page_url"
"Amazon Web Services, Inc","Chairman's Circle Sponsor","Seattle","WA","United States","For over 15 years, Amazon Web Services has been the world’s most comprehensive and broadly adopted cloud offering. AWS has been continually expanding its services to support virtually any cloud workload, and it now has more than 200 fully featured services for compute, storage, databases, networking, analytics, machine learning and artificial intelligence (AI), Internet of Things (IoT), mobile, security, hybrid, virtual and augmented reality (VR and AR), media, and application development, deployment, and management from 84 Availability Zones within 26 geographic regions, with announced plans for 24 more Availability Zones and eight more AWS Regions in Australia, Canada, India, Israel, New Zealand, Spain, Switzerland, and the United Arab Emirates. Millions of customers—including the fastest-growing startups, largest enterprises, and leading government agencies—trust AWS to power their infrastructure, become more agile, and lower costs. To learn more about AWS, visit aws.amazon.com.","https://aws.amazon.com/","https://www.linkedin.com/showcase/buywithprime/?trk=affiliated-pages","https://nrfbigshow.nrf.com/company/amazon-web-services-inc"
"American Express Company","Chairman's Circle Sponsor","New York","NY","United States","","http://www.americanexpress.com","","https://nrfbigshow.nrf.com/company/american-express-company"
"Aptos, LLC","Chairman's Circle Sponsor","Alpharetta","GA","United States","Aptos: The Leader in Unified Commerce  Aptos Unified Commerce solutions connect products to customers to unify both the customer experience and the enterprise. With hundreds of retailers live on our technology in more than 100,000 stores around the world, we know better than anyone how to empower the modern store as part of a unified omnichannel brand experience. Our unparalleled industry experience, earned over 40 years delivering technology to retail, informs and enriches our unique combination of CRM, Merchandising, Sales Audit, Order Management and Store Experience solutions.  Visit us at NRF booth #4639 to see the value of our comprehensive unified commerce solutions brought to life through numerous real-world shopping experiences, including: -Empowering the modern store with cloud-based, mobile and integrated POS experiences -Real-time inventory visibility across the extended retail enterprise -Acquiring (and activating) new customers across channels, locations, segments and brands -Integrated order management, including sourcing, routing and a full array of store fulfillment options","https://aptos.com","https://www.linkedin.com/company/aptos-retail/","https://nrfbigshow.nrf.com/company/aptos-llc"
"Microsoft Corporation","Chairman's Circle Sponsor","Redmond","WA","United States","Microsoft (Nasdaq “MSFT” @microsoft) is the leading platform and productivity company for the mobile-first, cloud-first world, and its mission is to empower every person and every organization on the planet to achieve more. Lean in to change and thrive during times of uncertainty with Microsoft Cloud for Retail. Anticipate the unexpected – from shifting market conditions to changing shopper expectations – and act with the power of all your data, at your fingertips. Deliver meaningful shopping experiences, in any channel, that speak to customers as individuals and delight at scale. Outmaneuver disruption with a sustainable supply chain that optimizes order management and reduces operating costs. And empower every employee to provide exceptional service that turns repeat customers into loyal fans. Become a resilient retailer – agile, innovative, and responsive – and achieve more with proven, end-to-end retail solutions only from Microsoft Cloud for Retail.","http://www.microsoft.com/retail","https://nam06.safelinks.protection.outlook.com/?url=https%3A%2F%2Fwww.linkedin.com%2Fshowcase%2Fmicrosoft-cloud-platform&amp;data=04%7C01%7Cv-mapric%40microsoft.com%7Cd2f0ef68f91046af29a008d984750e1b%7C72f988bf86f141af91ab2d7cd011db47%7C1%7C0%7C637686460546647095%7CUnknown%7CTWFpbGZsb3d8eyJWIjoiMC4wLjAwMDAiLCJQIjoiV2luMzIiLCJBTiI6Ik1haWwiLCJXVCI6Mn0%3D%7C1000&amp;sdata=OnLgnib%2FpGvouZqz6iZZheXBf76aZqK5xwNQwUxRJk4%3D&amp;reserved=0","https://nrfbigshow.nrf.com/company/microsoft-corporation"
"NCR Corporation","Chairman's Circle Sponsor","Atlanta","GA","United States","NCR is a leading software- and services-led enterprise provider that makes it easy for retailer to meet their customers wherever they are. Leading with digital, we connect the entire store, giving shoppers what they want: faster checkout. Options. Consistency.  With NCR technology retailers can create an easy, intuitive experience that makes their shoppers want to come back, while making their retail operations run smoother than ever.  Our hardware, software and services do more than just help retails rung their entire operation from back office to the front end. We connect every customer touchpoint into a single, amazing experience that makes shopping effortless for your customers while making business easier, faster and more profitable—from POS to payments to loyalty programs. For more information visit www.ncr.com/retail.","https://www.ncr.com","","https://nrfbigshow.nrf.com/company/ncr-corporation"
"SAP","Chairman's Circle Sponsor","Newtown Square","PA","United States","SAP provides an integrated suite of applications, intelligent technologies, and a real-time retail platform for retailers to drive efficiency and deliver amazing personalized customer experiences anywhere, anytime.  SAP retail solutions help digitally native startups to global retail brands manage all aspects of the retail business with the comprehensive solutions you need to exceed customer expectations with relevant products, information, and engagement when and where they choose to shop.  Learn how SAP can help you be amazing every time at http://www.sap.com/retail","http://www.sap.com/retail","https://www.linkedin.com/showcase/sap-retail/","https://nrfbigshow.nrf.com/company/sap"
"Shopify Inc.","Chairman's Circle Sponsor","Ottawa","ON","Canada","","","","https://nrfbigshow.nrf.com/company/shopify-inc"
"Zebra Technologies","Chairman's Circle Sponsor","Holtsville","NY","United States","For over 50 years, Zebra has been developing unparalleled data-driven retail solutions that provide the digital edge required to thrive in today’s omnichannel landscape. These solutions provide greater visibility by connecting people, assets and data. Zebra helps retailers advance their digital transformation by building smarter operations, optimizing inventory and enhancing the customer experience with innovative solutions such as:  Engaged Associates:   Communication & Collaboration Supply Chain Labor Efficiency Task Management Workforce Management   Optimized Inventory:   Forecasting & Pricing Inventory Management & Accuracy Loss Prevention & Asset Protection Returns Management RFID   Elevated Customer Experience:   Assisted Selling & Frictionless Checkout Personalized Shopping Returns Management  Zebra’s portfolio of retail solutions can provide visibility into every corner of retail operations and generate insights that drive performance and improve customer satisfaction. For more information, visit our website www.zebra.com/retail","http://www.zebra.com","https://www.linkedin.com/company/zebra-technologies/","https://nrfbigshow.nrf.com/company/zebra-technologies"
"Blue Yonder, Inc.","Platinum Level Sponsor","Scottsdale","AZ","United States","Blue Yonder is the world leader in digital supply chain transformations and omni-channel commerce fulfillment. Our end-to-end, cognitive business platform enables retailers, manufacturers and logistics providers to best fulfill customer demand from planning through delivery. With Blue Yonder, you’ll unify your data, supply chain and retail commerce operations to unlock new business opportunities and drive automation, control and orchestration to enable more profitable, sustainable business decisions. Blue Yonder - Fulfill your Potential™  blueyonder.com","https://blueyonder.com/","https://www.linkedin.com/company/blueyonder/","https://nrfbigshow.nrf.com/company/blue-yonder-inc"
"Comcast Business","Platinum Level Sponsor","Philadelphia","PA","United States","Comcast Business powers businesses with innovative technology and a team of dedicated professionals with industry leading expertise. Comcast Business offers a suite of Connectivity, Communications, Cybersecurity, Wireless, and Managed Solutions to help organizations of all sizes prepare for what’s next. Powered by the nation’s largest Gig-speed broadband network, and backed by 24/7 customer support, Comcast Business is a leading connectivity provider for small and mid-size businesses and a rising leader in the Enterprise market. Comcast Business has been recognized by industry analysts and associations as a leader and innovator, including an American Business Gold Award for Most Innovative Company in 2021.  For more information, call 866-429-3085. Follow on Twitter @ComcastBusiness and on other social media networks at http://business.comcast.com/social.","http://www.business.comcast.com","https://www.linkedin.com/company/comcast-business","https://nrfbigshow.nrf.com/company/comcast-business"
"commercetools Inc.","Platinum Level Sponsor","Durham","NC","United States","commercetools invented the headless, cloud-native approach to digital commerce, separating backend functionality from the front-end consumer interface. Furthermore, commercetools provides more than 300 APIs that can be configured into completely customized, scalable and consistent digital commerce experiences for web, mobile, social and IoT interfaces, and even interfaces that are yet to be developed.","","","https://nrfbigshow.nrf.com/company/commercetools-inc"
"DailyPay","Platinum Level Sponsor","New York","NY","United States","DailyPay, Inc., powered by its industry-leading technology platform, is on a mission to build a new financial system for everyone. DailyPay delivers the industry’s leading on-demand pay solution with modern, insight-driven pay strategies that help America’s leading employers to activate their workforce and build stronger relationships with their employees so they feel more engaged, work harder, and stay longer. Through its massive data network, proprietary funding model and connections into over 6,000 endpoints in the banking system, DailyPay works to ensure that money is always in the right place at the right time for employers, merchants and financial institutions. For more information, visit www.dailypay.com.","http://www.dailypay.com","","https://nrfbigshow.nrf.com/company/dailypay"
"Deloitte LLP","Platinum Level Sponsor","New York","NY","United States","Deloitte provides industry-leading audit, consulting, tax and advisory services to many of the world’s most admired brands, including nearly 90% of the Fortune 500® and more than 7,000 private companies. Our people come together for the greater good and work across the industry sectors that drive and shape today’s marketplace — delivering measurable and lasting results that help reinforce public trust in our capital markets, inspire clients to see challenges as opportunities to transform and thrive, and help lead the way toward a stronger economy and a healthier society. Deloitte is proud to be part of the largest global professional services network serving our clients in the markets that are most important to them. Building on more than 175 years of service, our network of member firms spans more than 150 countries and territories. Learn how Deloitte’s more than 345,000 people worldwide connect for impact at www.deloitte.com.","http://www.deloitte.com/us","","https://nrfbigshow.nrf.com/company/deloitte-llp"
"IBM Corporation","Platinum Level Sponsor","Armonk","NY","United States","IBM is a global technology and innovation company and decades-long strategic partner to the retail industry. IBM combines leading technology and deep industry expertise to help clients quickly and securely realize the benefits of advanced technology like AI. Generate insights at the point of engagement and provide a seamless omni-channel experience to delight customers. Build an intelligent supply chain that provides clients supply chain visibility, surety and agility. And drive seamless customer care with AI-powered automation that frees up teams to focus on the most important tasks.  IBM helps companies win the green shopper with a comprehensive sustainability suite that harnesses data, reduces costs and helps eliminate waste. Seamlessly integrate improvements with existing infrastructure to rapidly see value. All of this is backed by IBM's legendary commitment to trust, transparency, responsibility, sustainability, inclusivity, and service. For more information, visit www.ibm.com.","http://www.ibm.com","","https://nrfbigshow.nrf.com/company/ibm-corporation"
"Lenovo","Platinum Level Sponsor","Morrisville","NC","United States","Lenovo (HKSE: 992) (ADR: LNVGY) is a US$60 billion revenue Fortune Global 500 company serving customers in 180 markets around the world. Focused on a bold vision to deliver smarter technology for all, we are developing world-changing technologies that power (through devices and infrastructure) and empower (through solutions, services and software) millions of customers every day and together create a more inclusive, trustworthy and sustainable digital society for everyone, everywhere. To find out more visit https://www.lenovo.com, and read about the latest news via our Story Hub.","https://lenovoretailsolution.com/","","https://nrfbigshow.nrf.com/company/lenovo"
"PricewaterHouseCoopers, LLP","Platinum Level Sponsor","New York City","NY","United States","","http://www.pwc.com","","https://nrfbigshow.nrf.com/company/pricewaterhousecoopers-llp"
"SAP","Chairman's Circle Sponsor","Newtown Square","PA","United States","SAP provides an integrated suite of applications, intelligent technologies, and a real-time retail platform for retailers to drive efficiency and deliver amazing personalized customer experiences anywhere, anytime.  SAP retail solutions help digitally native startups to global retail brands manage all aspects of the retail business with the comprehensive solutions you need to exceed customer expectations with relevant products, information, and engagement when and where they choose to shop.  Learn how SAP can help you be amazing every time at http://www.sap.com/retail","http://www.sap.com/retail","https://www.linkedin.com/showcase/sap-retail/","https://nrfbigshow.nrf.com/company/sap"
"Schaefer Systems International, Inc.","Platinum Level Sponsor","Charlotte","NC","United States","Schaefer Systems International, Inc. is a leading supplier of innovative automation systems, integrated warehouse management technology, and storage solutions for retail and wholesale companies. SSI SCHAEFER provides end-to-end solutions for distribution and warehouse operation facilities including high-density storage, picking solutions, vertical lift storage, automated guided vehicles, and warehouse management software for storefront, e-commerce, and omnichannel distribution. Schaefer Systems International, Inc. is part of the SSI SCHAEFER Group, a global leader in intralogistics and material handling solutions. Founded in 1937, SSI SCHAEFER is a privately owned family company, with over 70 office locations, seven manufacturing facilities, and over 9,000 associates worldwide. SSI SCHAEFER powers the world's largest retail distribution centers with millions of orders processed daily. For more information, visit www.ssi-schaefer.com or schaefersolutions.com.","https://www.ssi-schaefer.com","https://www.linkedin.com/company/ssischaefer/","https://nrfbigshow.nrf.com/company/schaefer-systems-international-inc"
"T-Mobile For Business","Platinum Level Sponsor","Bellevue","WA","United States","With the world changing faster than ever, businesses don’t have time to wait for carriers to play catch-up. That’s why T-Mobile for Business provides the solutions you need to stay ahead, today. We use unconventional thinking to deliver America's largest 5G network, 360 support customized to your business, and incredible value to help you achieve better outcomes and ROIs—all of it, ready right now. It’s time to move forward and join a partner that supports your success on our ready-to-deploy network: T-Mobile for Business.  See what our ready right now 5G solutions can do for you: www.t-mobile.com/business.","http://www.t-mobile.com","https://www.linkedin.com/showcase/t-mobile-business/ ","https://nrfbigshow.nrf.com/company/t-mobile-business"
"Toshiba Global Commerce Solutions, Inc.","Platinum Level Sponsor","Durham","NC","United States","Toshiba Global Commerce Solutions is a global market share leader in retail store technology and retail’s first choice for unified commerce solutions. Together with a global team of dedicated business partners, we advance the future of retail with innovative commerce solutions that enhance customer engagement, transform the in-store experience, and accelerate digital transformation. To learn more, visit commerce.toshiba.com and engage with us on Twitter, LinkedIn, Facebook, Instagram and YouTube.","https://commerce.toshiba.com/","https://www.linkedin.com/company/ToshibaCommerce","https://nrfbigshow.nrf.com/company/toshiba-global-commerce-solutions-inc"
"VTEX","Platinum Level Sponsor","Ft. Lauderdale","FL","United States","VTEX offers a global, fully integrated digital commerce platform with native marketplace and OMS capabilities. We help enterprises in retail, manufacturing, wholesale, grocery, consumer packaged goods and other verticals to sell more, operate more efficiently, scale seamlessly and deliver remarkable customer experience. Our modern API and microservice-based architecture and our powerful business and developer tools give our customers the flexibility to grow and evolve their business and free them from software updates. Major brands including Whirlpool, Sony, Crate & Barrel, Adidas, L’oreal, Levi’s, Nestlé and C&A, plus 2,500 active online stores across 32 countries, trust VTEX to accelerate and transform their commerce. Visit http://www.vtex.com to learn more.","http://www.vtex.com","","https://nrfbigshow.nrf.com/company/vtex"
"ADYEN","Gold Level Sponsor","San Francisco","CA","United States","Adyen (AMS: ADYEN) is the financial technology platform of choice for leading companies. By providing end-to-end payments capabilities, data-driven insights, and financial products in a single global solution, Adyen helps businesses achieve their ambitions faster. With offices around the world, Adyen works with the likes of Facebook, Uber, H&M, eBay, and Microsoft.","https://nrfbigshow.nrf.com/company/adyen","https://www.linkedin.com/company/adyen/mycompany/verification/","https://nrfbigshow.nrf.com/company/adyen"
"Algolia","Gold Level Sponsor","San Francisco","CA","United States","Algolia is revolutionizing search and discovery by providing the world's most powerful API-First Search and Discovery Platform with its unique hybrid search engine, which is a combination of keyword and vector-based semantic search via NeuralSearch technology, in a single API. Algolia empowers both builders and business users with a better way to build unique and engaging end user experiences at Internet scale to predict what customers want with blazing fast speed and the best application browse experience leading to more remarkable Discovery. Algolia is your guide to the world’s content powering discovery where you live, work, and play. Discovery, as a result, is reinvented as the right content finds each user to inform, enrich and surprise. More than 12,500 companies including Under Armour, Birchbox, Stripe, Slack, Medium, and Zendesk rely on Algolia to manage over 1.5 trillion search queries a year. Algolia is headquartered in San Francisco with offices in New York, Atlanta, Austin, Paris, London, Bucharest, and Sydney. To learn more, visit www.algolia.com.","http://www.algolia.com","https://www.linkedin.com/company/algolia/","https://nrfbigshow.nrf.com/company/algolia"
"CommerceHub","Gold Level Sponsor","Latham","NY","United States","CommerceHub is a leading ecommerce enablement platform connecting supply, demand and delivery that helps retailers and brands increase sales by expanding product assortments, promoting products on the channels that perform, and enabling rapid, on-time customer delivery. CommerceHub helps its robust network of thousands of retailers, brands, and distributors achieve over $30 billion in Gross Merchandise Value annually. Visit commercehub.com.","http://www.commercehub.com","","https://nrfbigshow.nrf.com/company/commercehub"
"Coveo","Gold Level Sponsor","Quebec City","QC","Canada","Coveo is an AI Relevance Platform that powers ecommerce experiences such as: Search, Navigation, Recommendations, and Personalization. Coveo delivers packaged machine learning models to get your site search relevant on day 1 of adoption. The platform allows you to scale across brand sites, regions, complexity and use-cases to meet demand with ease. Coveo also arms merchandisers with scalable automation tools to reduce manual effort, optimize shopping experiences, and personalize content and promotions for customers, to bring the most value to the business.","https://www.coveo.com/en","","https://nrfbigshow.nrf.com/company/coveo"
"Cust2mate","Gold Level Sponsor","Tel Aviv","","Israel","","","","https://nrfbigshow.nrf.com/company/cust2mate"
"Dell Technologies","Gold Level Sponsor","Round Rock","TX","United States","Retail’s Digital Future is Now!Every organization needs to be a digital organization, powered by data, running in a multi-cloud world. At Dell Technologies, we continue to innovate, developing technology so you are always ready to move forward. Explore Retail IT Solutions to improve decisions throughout the retail value chain to collect, aggregate, and analyze data, improving margins, decreasing costs, and reducing security risks.  Dell Technologies will be there with the technology and the expertise to bring it all together to help you prepare for what is coming next.    Learn more at DellTechnologies.com/Retail.","https://www.delltechnologies.com/retail","","https://nrfbigshow.nrf.com/company/dell-technologies"
"Impact Analytics","Gold Level Sponsor","Linthicum Heights","MD","United States","Impact Analytics (IA) is delivering on the promise of AI through its proven enterprise-scale AI platform and products. Its next-generation products for planning, forecasting, merchandising, and end-to-end lifecycle pricing empowers leading retailers, grocers, CPG brands, and manufacturers with prescriptive analytics to fuel substantial improvements in revenue, margin, and critical KPIs.  Highly rated by industry peers and market researchers, the Company’s proven SmartSuite and forecasting products for assortment planning, inventory optimization, markdown optimization, and promotion planning are deployed at forward-looking retailers driving smarter decision with real-time insights, including 10 of the top 25 retailers, three of the top 10 CPG companies, and five leading global manufacturers. IA also helps retailers’ sustainability efforts through smarter merchandising and allocation decisions that are more precise, reducing waste and their carbon footprint.  www.impactanalytics.co","https://www.impactanalytics.co/","https://www.linkedin.com/company/impact-analytics/","https://nrfbigshow.nrf.com/company/impact-analytics"
"JCM Commerce Mechatronics Inc.","Gold Level Sponsor","Schaumburg","IL","United States","JCM is the leader in creating innovative and award-winning automated transaction technologies and solutions for diverse industries such as banking, financial, gaming, kiosk, retail, transportation, vending and specialty industries, lines of business where security, speed and accuracy are more than requirements – they’re necessities.  Our bill / coin validation technologies, printer technologies, system solutions and digital media solutions are world-renowned for helping customers make better connections with their customers. And we back up our products with a service program that our competitors envy and our customers love.  https://www.jcm-hq.co.jp/english/","https://www.jcm-hq.co.jp/english/","","https://nrfbigshow.nrf.com/company/jcm-commerce-mechatronics-inc"
"Klaviyo","Gold Level Sponsor","Boston","MA","United States","","http://www.klaviyo.com","https://www.linkedin.com/company/klaviyo/mycompany/verification/","https://nrfbigshow.nrf.com/company/klaviyo"
"Koerber Supply Chain","Gold Level Sponsor","Minneapolis","MN","United States","Supply chains are growing more complex by the day. Körber uniquely provides a broad range of proven, end-to-end supply chain solutions fitting any business size, strategy or appetite for growth. Capable of delivering not just software, but automation, voice, robotics, and materials handling – plus the expertise to tie it all together. We are a global partner not just for today, but also as the needs of supply chains continue to evolve. Conquer supply chain complexity – with Körber. The Körber Business Area Supply Chain is part of the global technology group Körber. Find out more on www.koerber-supplychain.com","http://www.koerber-supplychain.com","https://www.linkedin.com/company/koerber-supply-chain","https://nrfbigshow.nrf.com/company/koerber-supply-chain"
