"sponser_name","sponser_level","sponser_city","sponser_state","sponser_country","sponser_description","sponser_website","sponser_linkedin","sponser_page_url"
"Kyndryl, Inc.","Gold Level Sponsor","New York","NY","United States","Kyndryl is a talent-based professional services organization, supporting the core of businesses that move the world. We are the newest global systems integrator, powered by more than 90,000 skilled professionals serving customers in over 100 countries. We design, build, manage and modernize mission-critical technology systems that global retailers depend on every day. We are creating a retail world powered by digital systems, co-creating incremental changes that raise the standard of the retail industry.  We help the world’s biggest companies realize big ambitions and discover new ones.  We are devoted to our customers and committed to their success, delivering outcome-based solutions and services, using technology enablers and a vast partnership ecosystem. To learn more, visit www.kyndryl.com","","https://www.linkedin.com/company/kyndryl/","https://nrfbigshow.nrf.com/company/kyndryl-inc"
"Legion Technologies","Gold Level Sponsor","Palo Alto","CA","United States","Intelligent Automation powered by Legion WFM maximizes labor efficiency and employee engagement simultaneously. Legion WFM has been proven to deliver 13x ROI through schedule optimization, reduced attrition, increased productivity, and increased operational efficiency. Legion automates day-to-day decisions freeing managers to focus on their businesses and employees. Hourly employees get gig-like flexibility, modern clock-aware communication tools, instant access to earned wages, and performance and rewards - in a single, easy-to-use platform and mobile app that employees love. Learn more at https://legion.co.","https://legion.co/","https://www.linkedin.com/company/legionco","https://nrfbigshow.nrf.com/company/legion-technologies"
"Manhattan Associates, Inc.","Gold Level Sponsor","Atlanta","GA","United States","Manhattan is a technology leader focused on improving experiences and outcomes in supply chain commerce. We provide leading software solutions for omnichannel commerce, supply chain planning and supply chain execution. Our cloud-native Manhattan Active® platform technology and unmatched industry experience help increase top-line growth and bottom-line efficiency for the world’s leading brands. Manhattan designs, builds and delivers innovative solutions for stores, transportation networks and fulfillment centers, eliminating silos created by legacy commerce, warehouse, and transportation systems to create seamless operations and optimal efficiency. Manhattan is committed to the exploration of data and behavioral sciences, using machine learning to optimize every shipment and gamification to improve every associate experience. Manhattan enables organizations to achieve a more sustainable future by using fewer resources, traveling fewer miles, and reducing waste. For more information, visit www.manh.com","https://www.manh.com","https://www.linkedin.com/company/manhattan-associates/mycompany/","https://nrfbigshow.nrf.com/company/manhattan-associates-inc"
"NCR Corporation","Chairman's Circle Sponsor","Atlanta","GA","United States","NCR is a leading software- and services-led enterprise provider that makes it easy for retailer to meet their customers wherever they are. Leading with digital, we connect the entire store, giving shoppers what they want: faster checkout. Options. Consistency.  With NCR technology retailers can create an easy, intuitive experience that makes their shoppers want to come back, while making their retail operations run smoother than ever.  Our hardware, software and services do more than just help retails rung their entire operation from back office to the front end. We connect every customer touchpoint into a single, amazing experience that makes shopping effortless for your customers while making business easier, faster and more profitable—from POS to payments to loyalty programs. For more information visit www.ncr.com/retail.","https://www.ncr.com","","https://nrfbigshow.nrf.com/company/ncr-corporation"
"Nedap","Gold Level Sponsor","Burlington","MA","United States","Nedap Retail is the global leader in RFID-based retail solutions. Perfect inventory visibility, zero waste and no losses. That’s our vision for every retailer in this world. The Nedap iD Cloud Platform makes it simple for retailers to always have the right products available, at the right place and at the right time by creating a complete and transparant view of the supply chain.","http://www.nedap-retail.com","","https://nrfbigshow.nrf.com/company/nedap"
"SML RFID","Gold Level Sponsor","Plano","TX","United States","With a presence in over 20 countries, SML Group is the global end-to-end RFID and brand identification solutions provider, delivering proven results and rapid ROIs to brands in the new era of retailing. We offer innovative InspireTM and EcoInspireTM labeling and packaging products, high-performance RFID tags and encoding services across industries. Our proprietary software Clarity® is the only item-level RFID solution that is engineered and deployment-proven for vertical retailers and brand owners with stores. As an invaluable partner of brands, SML is committed to developing tech-driven solutions that power brand transformation and prosperity.  For more information about our SML RFID TotalCare™ Solutions visit our website or reach out to us at info@sml-rfid.com.","https://www.sml.com/rfid-software/","https://www.linkedin.com/company/sml-rfid/","https://nrfbigshow.nrf.com/company/sml-rfid"
"SOTI, Inc.","Gold Level Sponsor","Mississauga","ON","Canada","SOTI is a proven innovator and industry leader for mobility and IoT management. Globally, over 17,000 companies depend on SOTI to enable their strategies for mobile devices, applications, content, as well as endpoints for the Internet of Things. SOTI's extensive vertical experience provides unparalleled insight into each company's unique business needs. Strong relationships with mobile technology and IoT partners around the world gives SOTI advanced knowledge of new technologies and cutting-edge business solutions. SOTI's commitment to innovation ensures your business is one step ahead with the solutions you need to take mobility to endless possibilities.","https://soti.net/industries/retail?utm_source=event&amp;utm_medium=sponsored&amp;utm_campaign=NRF_2023","https://www.linkedin.com/company/soti","https://nrfbigshow.nrf.com/company/soti-inc"
"Square","Gold Level Sponsor","San Francisco","CA","United States","Square helps sellers more easily run and grow their businesses with its integrated ecosystem of commerce solutions. Square offers purpose-built software to run complex restaurant, retail, and professional services operations, versatile e-commerce tools, embedded financial services and banking products, buy now, pay later functionality through Afterpay, staff management and payroll capabilities, and much more – all of which work together to save sellers time and effort. Millions of sellers across the globe trust Square to power their business and help them thrive in the economy. Square is part of Block, Inc. (NYSE: SQ), a global technology company with a focus on financial services. For more information, visit www.squareup.com.","http://www.square.com","","https://nrfbigshow.nrf.com/company/square"
"Talkdesk","Gold Level Sponsor","San Francisco","CA","United States","Talkdesk® is a global cloud contact center leader for customer-obsessed companies. Our automation-first customer experience solutions optimize our customers’ most critical customer service processes. Our speed of innovation, vertical expertise, and global footprint reflect our commitment to ensuring that businesses can deliver better experiences across any industry and through any channel, resulting in higher customer satisfaction and accelerated business outcomes.","http://www.talkdesk.com","https://www.linkedin.com/company/talkdesk","https://nrfbigshow.nrf.com/company/talkdesk"
"Unity Technologies SF","Gold Level Sponsor","San Francisco","CA","United States","Unity (NYSE: U) is the world’s leading platform for creating and operating real-time 3D (RT3D) content. Creators, ranging from game developers to artists, architects, automotive designers, filmmakers, and others, use Unity to make their imaginations come to life. Unity’s platform provides a comprehensive set of software solutions to create, run and monetize interactive, real-time 2D and 3D content for mobile phones, tablets, PCs, consoles, and augmented and virtual reality devices. The company’s 1,800+ person research and development team keeps Unity at the forefront of development by working alongside partners to ensure optimized support for the latest releases and platforms. Apps developed by Unity creators were downloaded more than five billion times per month in 2020. For more information, please visit www.unity.com.","http://unity.com","https://www.linkedin.com/company/unity-technologies","https://nrfbigshow.nrf.com/company/unity-technologies-sf"
"Walmart Commerce Technologies","Gold Level Sponsor","Bentonville","AR","United States","Walmart Commerce Technologies offers businesses of all sizes white-label solutions to help transform and grow their operations. Empowering businesses to navigate and meet the rapidly evolving needs of customers at scale.  Walmart Commerce Technologies recently launched Store Assist, an out-of-the box, mobile-first store fulfillment application, which unlocks buy online pickup in-store or curbside (BOPIS) experiences for your customers. Our fulfillment technology has been proven in Walmart stores for the last decade and built on 60 years of industry leadership. From in-store picking to customer hand-off, our white-label solutions will help you reach new audiences, improve your profit margins and deliver a great customer experience every time. For more information or to get in touch with our team, please visit commerce.walmart.com.","","","https://nrfbigshow.nrf.com/company/walmart-commerce-technologies"
"Zipline","Gold Level Sponsor","San Francisco","CA","United States","Zipline is how best-in-class brands bring corporate strategies to life in stores. A unified platform for operational excellence, Zipline brings together frontline communications, task management, resources, insights, and more, allowing everyone to feel connected to the brand and inspired by their work. The company has an NPS of 76 and was named to the Inc. 5000 list of fastest-growing private companies. CBInsights ranked Zipline as one of the 100 most promising B2B retail tech companies. Today, more than 75 brands like Rite Aid, Sephora, and AEO, Inc. depend on Zipline to align and empower their store teams worldwide.","http://getzipline.com","https://www.linkedin.com/company/get-zipline","https://nrfbigshow.nrf.com/company/zipline"
"Avalara","Silver Level Sponsor","Seattle","WA","United States","Avalara helps retail businesses achieve compliance with transaction taxes. In partnership with leading ERP, accounting, ecommerce and other financial management system providers, Avalara delivers comprehensive, automated, cloud-based solutions designed to be fast, accurate, and easy to use. Visit www.avalara.com.","http://www.avalara.com","https://www.linkedin.com/company/avalara ","https://nrfbigshow.nrf.com/company/avalara"
"Axonify","Silver Level Sponsor","Waterloo","ON","Canada","Axonify is the modern training and communications solution for frontline employees that delivers. Why does it work so well? Because the experience is fun, fast, personalized and designed to make critical information stick. And employees love it—83% of users log in 2-3 times a week, which translates into meaningful behavior change that drives business results. More than 200 customers in 155+ countries around the world, including Walmart, Bloomingdale’s, Levi's and Merck, trust Axonify to fuel their people's performance to keep pace with their business. Founded in 2011, Axonify is headquartered in Waterloo, ON Canada. For more information, please visit http://www.axonify.com.","http://www.axonify.com","https://www.linkedin.com/company/axonify/mycompany/","https://nrfbigshow.nrf.com/company/axonify"
"BigCommerce","Silver Level Sponsor","Austin","TX","United States","BigCommerce (Nasdaq: BIGC) is a leading software-as-a-service (SaaS) ecommerce platform that empowers merchants of all sizes to build, innovate and grow their businesses online. As a leading open SaaS solution, BigCommerce provides merchants sophisticated enterprise-grade functionality, customization and performance with simplicity and ease-of-use. Tens of thousands of B2B and B2C companies across 120 countries and numerous industries use BigCommerce to create beautiful, engaging online stores, including Ben & Jerry’s, Skullcandy and Sony. Headquartered in Austin, BigCommerce has offices in San Francisco, Sydney and London. Learn more at www.bigcommerce.com. BigCommerce® is a registered trademark of BigCommerce Pty. Ltd. Third-party trademarks and service marks are the property of their respective owners.","https://www.bigcommerce.com/","","https://nrfbigshow.nrf.com/company/bigcommerce"
"Bringg","Silver Level Sponsor","Tel Aviv","","Israel","E-commerce is a core part of today’s business, which puts immediate pressure on retailers to offer the best customer experience while lowering costs.       Bringg is a Delivery Management Platform (DMP) – that is all about efficiency. We manage and unify your delivery and returns operations whether you use your own drivers, external delivery providers, and also offer your customers with various pick up options.        Bringg serves over 100 market leading brands such as, Raymour & Flanigan, H&M, Imperfect Foods, RBI, Chick-fil-A, Wegmans, COOP, ADEO, Asda, Goodyear, Autozone and more, allowing them to turn delivery and returns experiences into brand and growth drivers.","https://www.bringg.com/","","https://nrfbigshow.nrf.com/company/bringg"
"fabric","Silver Level Sponsor","Seattle","WA","United States","fabric’s mission is to accelerate the GMV of the Internet by ending the pain of replatforming.  By democratizing access to best-in-class digital commerce tooling, fabric allows merchants who aren’t served well by Shopify, Oracle, or Salesforce (and other hosted platforms) to thrive in an e-commerce world. Customers like BuildDirect, and GNC trust fabric for its open and modular design that allows them to be live within just a few months without having to replatform. fabric is a force multiplier on retailers’ existing technology investments proven to grow digital revenue by up to 3x. Headquartered in the Cloud Capital Seattle, Washington, with offices and customers around the world, fabric is backed by SoftBank, Glynn Capital, Forerunner Ventures, Stripes, B Capital Group, Greycroft, Norwest Venture Partners, Redpoint Ventures, Sierra Ventures, Innovation Global Capital, Ascend Venture Capital, and Expa. To learn more, visit https://fabric.inc.","https://fabric.inc","https://www.linkedin.com/company/teamfabric/","https://nrfbigshow.nrf.com/company/fabric"
"Glassbox","Silver Level Sponsor","New York","NY","United States","Glassbox empowers organizations to create frictionless digital journeys for their customers. Our digital experience analytics platform works in real time across mobile apps and the web to accelerate loyalty and growth. Hundreds of enterprises across multiple industries have chosen Glassbox for easy, secure and private cloud-based deployments.","https://www.glassbox.com/","https://www.linkedin.com/company/glassbox-solutions/","https://nrfbigshow.nrf.com/company/glassbox"
"Maersk","Silver Level Sponsor","Florham Park","NJ","United States","A.P. Moller - Maersk’s vision is to become the Global Integrator   Increasing complexity in global supply chains is making them inefficient, vulnerable and unsustainable. At Maersk, our strategic vision is to become the Global Integrator, offering truly integrated logistics solutions that connect, protect and simplify our customers’ supply chains. Maersk stats at a glance Our vision is transforming logistics across oceans, continents, flightpaths, platforms and networks. The numbers speak for themselves. 100,000+employees 730+container vessels deployed 67terminals across 42 countries 130countries 100,000+customers 3bn business events on maersk.com 3m+ SQM warehousing capacity worldwide 2040 Net Zero climate-neutral across our business","https://www.maersk.com/","https://www.linkedin.com/company/maersk-group/mycompany/","https://nrfbigshow.nrf.com/company/maersk"
"MIRAKL, INC","Silver Level Sponsor","Somerville","MA","United States","Mirakl offers the industry’s first and most advanced enterprise marketplace SaaS platform. With Mirakl, organizations across B2B and B2C industries can launch marketplaces faster, grow bigger, and operate with confidence as they exceed rising customer expectations. Platforms are the new competitive advantage in eCommerce, and the world’s most trusted brands choose Mirakl for its comprehensive solution of technology, expertise, and the Mirakl Connect ecosystem to unlock the power of the platform business model for them. As a result, companies like Bed Bath & Beyond, Carrefour, Catch, Darty, Express, Galeries Lafayette, The Kroger Co., Leroy Merlin, and Maisons du Monde, and Macy's gain the speed, scale and agility to win in the changing eCommerce landscape. For more information: www.mirakl.com.","https://www.mirakl.com/","","https://nrfbigshow.nrf.com/company/mirakl-inc"
"NewStore","Silver Level Sponsor","Boston","MA","United States","NewStore is a turnkey omnichannel store solution for global DTC brands. In over 20 countries, the company delivers Omnichannel-as-a-Service with the first cloud platform combining POS, order management, inventory, and clienteling. Store operations from endless aisle to mobile checkout to fulfillment are possible with just two remarkably intuitive iPhone apps. NewStore customers include brands such as Burton Snowboards, Decathlon, GANNI, Goorin Bros, Marine Layer, Outdoor Voices, and UNTUCKit. It is backed by General Catalyst, Activant Capital, and Salesforce Ventures. Learn more at www.newstore.com.","http://www.newstore.com","","https://nrfbigshow.nrf.com/company/newstore"
"Sprinklr","Silver Level Sponsor","New York","NY","United States","","http://www.sprinklr.com","https://www.linkedin.com/company/sprinklr/","https://nrfbigshow.nrf.com/company/sprinklr"
"Stibo Systems","Silver Level Sponsor","Atlanta","GA","United States","Stibo Systems has proven to be an outstanding SaaS Master Data management solution serving hundreds of companies around the globe in different retail and consumer industries such as grocery, apparel, home improvement/DIY, hardlines, health and beauty, hospitality and automotive products. Stibo Systems retail solution leverages the strengths of a single, open, integrated and compoundable, flexible, automated and efficient data platform and combines them with industry best practices materialized in predefined data models, workflows and data governance processes to speed up business value in the form of reduced time to value, improved omnichannel execution, extended data traceability or better customer experiences, while supporting sustainability initiatives and reducing operational risk. Leading retail companies including M&S, Advance Auto Parts, Best Buy, Auchan Retail and Mitchells & Butlers rely on Stibo Systems to unlock the power of their data. Learn more at stibosystems.com.","https://www.stibosystems.com","https://www.linkedin.com/company/stibosystems/","https://nrfbigshow.nrf.com/company/stibo-systems"
"Treasure Data","Silver Level Sponsor","Mountain View","CA","United States","Treasure Data Customer Data Cloud helps enterprises use all of their customer data to improve campaign performance, achieve operational efficiency, and drive business value with connected customer experiences. Our suite of customer data platform solutions integrates customer data, connects identities in unified customer profiles, applies privacy, and makes insights and predictions available for Marketing, Service, Sales and Operations to drive personalized engagement and improve customer acquisition, sales, and retention.       Treasure Data is trusted by hundreds of Fortune 500 and Global 2000 companies, has won numerous awards, and has been named a strong performer and leader by top analyst firms. Headquartered in Mountain View, CA, Treasure Data has offices in Japan, South Korea, England and France to help leading brands around the world make the connection. To learn more, visit www.treasuredata.com.","https://www.treasuredata.com","https://www.linkedin.com/company/treasure-data-inc-/","https://nrfbigshow.nrf.com/company/treasure-data"
"Visa","Silver Level Sponsor","Foster City","CA","United States","","","","https://nrfbigshow.nrf.com/company/visa"
"Workday","Silver Level Sponsor","Pleasanton","CA","United States","Workday is a leading provider of enterprise cloud applications. Founded in 2005, Workday combines HR, payroll, finance, planning, and analytics in a single cloud-based, global, mobile-ready system to help retailers focus resources on driving growth and profitability. Workday can help retailers increase operational efficiency across channels, transform for new business models, attract and retain top talent to increase customer lifetime value, and avoid compliance risks and costly penaltis to protect consumer trust.","https://www.workday.com/","https://www.linkedin.com/company/workday/mycompany/verification/","https://nrfbigshow.nrf.com/company/workday"
"WorkJam","Silver Level Sponsor","Montreal","QC","Canada","WorkJam’s mission is to revolutionize the way HQs and their frontline work together. As the world leader in the digital frontline workplace, WorkJam combines two-way communication, task management, learning, scheduling tools and more to drive efficiencies and productivity. Available in over 45 languages, WorkJam turns workflow chaos into workforce orchestration®. HQs love it for its ROI (a whopping 410%) and employees love it because it puts workplace competencies right into their hands. If we want a happier frontline, we need to support them as individuals with upskilling, shift scheduling, and processes – all on one app. #WorkJamYourFrontline","https://www.workjam.com/","https://www.linkedin.com/company/workjam","https://nrfbigshow.nrf.com/company/workjam"
"YOOBIC","Silver Level Sponsor","New York","NY","United States","YOOBIC is the #1 Frontline Experience Platform designed to create the most engaging and productive digital workplace for frontline teams. It equips employees with tools for communication, training, and task management — all in the flow of work. The YOOBIC app is mobile, social, gamified, personalized, and AI-powered. 300+ global brands including Roots, Boots, Burgerfi, Untuckit, Lancôme, Lacoste, Peloton, Levi’s and Timberland rely on YOOBIC to drive frontline success. To learn more, go to www.yoobic.com Retail leaders rely on YOOBIC to: Get visibility into the execution of merchandising, promotions and retail processes Improve consistency in performance and compliance across their store network Simplify and speed up operational store processes Easy and quickly communicate HQ and regional messages to store managers and field employees Effectively and easily onboard and train store teams","http://www.yoobic.com","https://www.linkedin.com/company/5143366/admin/","https://nrfbigshow.nrf.com/company/yoobic"
"ACI Worldwide","Bronze Level Sponsor","Miami","FL","United States","ACI Worldwide is a global software company that delivers mission-critical real-time payment solutions to corporations. Customers use our proven, scalable solutions to process and manage digital payments, enable omni-commerce payments, present and process bill payments, and manage fraud and risk. We combine our global footprint with local presence to drive the real-time digital transformation of payments and commerce. Visit us at www.aciworldwide.com","http://www.aciworldwide.com","https://www.linkedin.com/company/aci-worldwide","https://nrfbigshow.nrf.com/company/aci-worldwide"
"Adobe","Bronze Level Sponsor","San Jose","CA","United States","","https://www.adobe.com/commerce/magento.html","","https://nrfbigshow.nrf.com/company/adobe"
"Anaplan","Bronze Level Sponsor","San Francisco","CA","United States","Anaplan is a transformative way to see, plan, and run your business. Using our proprietary Hyperblock™ technology, Anaplan lets you contextualize real-time performance, and forecast future outcomes for faster, confident decisions. Anaplan enables connected strategy and planning across your enterprise to move your business forward. Based in San Francisco, Anaplan has over 200 partners and more than 2,000 customers worldwide. To learn more, visit www.anaplan.com.","http://www.anaplan.com","https://www.linkedin.com/company/anaplan/","https://nrfbigshow.nrf.com/company/anaplan"
